{
  "id": "planning-education",
  "title": "Planning Education & Pedagogy",
  "description": "Courses, teaching approaches, and learning materials across planning and allied fields. A starter space for educators and students from different universities.",
  "organizerType": "Cross-University Collaboration",
  "organizer": "",
  "institution": "",
  "fields": [
    "planning",
    "interdisciplinary"
  ],
  "topics": [
    "track-8"
  ],
  "status": "starter"
}
