{
  "id": "environment-and-climate",
  "title": "Environment & Climate",
  "description": "Environmental planning, climate adaptation, resilience, and sustainability. A starter space connecting planning knowledge with environmental research and practice. Contributions can include education, research, and practice materials.",
  "organizerType": "Cross-University Collaboration",
  "organizer": "",
  "institution": "",
  "fields": [
    "environment",
    "planning"
  ],
  "topics": [
    "track-3"
  ],
  "status": "starter"
}
