{
  "id": "community-and-housing",
  "title": "Community Development & Housing",
  "description": "Housing, community development, participation, and inclusive neighborhoods. A starter space for resources contributed across committees, disciplines, and institutions. Contributions can include education, research, and practice materials.",
  "organizerType": "Cross-University Collaboration",
  "organizer": "",
  "institution": "",
  "fields": [
    "planning",
    "health",
    "policy"
  ],
  "topics": [
    "track-2",
    "track-4"
  ],
  "status": "starter"
}
