{
  "id": "ai-in-planning",
  "title": "AI in Planning",
  "description": "Teaching, research, and applications of artificial intelligence in planning. Retained from the original repository as one collection within the broader hub.",
  "organizerType": "Cross-University Collaboration",
  "organizer": "",
  "institution": "",
  "fields": [
    "planning",
    "computing"
  ],
  "topics": [
    "track-1"
  ],
  "status": "starter"
}
